KPI,Description,Target/Threshold
Delivery Success Rate,Percentage of orders successfully delivered,≥ 95%
On-time Delivery Rate,Percentage of orders delivered on time,≥ 60%
Order Fulfillment Time,Average time taken to fulfill an order,< 48 hours
Customer Satisfaction,Average rating of customer satisfaction,≥ 3 out of 5
Shipping Cost Efficiency,Average cost of shipping per order,Reduce by 5% annually
Return Rate,Percentage of orders returned by customers,< 10%
Inventory Turnover Rate,How quickly inventory is sold and replaced,4 times per year
Average Shipping Time,Average time taken for delivery,< 5 days
Customer Support Response Time,Average time taken to respond to customer queries,< 24 hours